source,review_id,review_description,review_title,rating,thumbs_up,review_date,developer_response,developer_response_date,appVersion,laguage_code,country_code
Google Play,4b838f3f-8667-4ed1-a534-2a149998ba08,"Looking for a positive comment, unable to locate any. Slow to up date information. Graphs are all useless. They are too general and can not determine if correct. They should go back to the way they were so you can determine a pattern or event. Auto sleep/awake not available, tapped sleep/awake works most of time but with changes if you forget, out if luck. Yes they keep changing to get you to pay for premium. Now why should I do that for more useless graphs? Right now a pedometer is all you get.",,1,0,2024-04-20 19:37:51,,,4.14.fitbit-mobile-110045073-617559692,en,us
Google Play,9ec70aa4-9bcb-4c28-ba02-624537e3403e,They continue to remove more features. Information is hard to find our not there. Looks like they are trying to run the company into the ground since they were bought out.,,1,1,2024-04-20 19:24:30,,,4.15.fitbit-mobile-110048703-624243509,en,us
Google Play,a8a91145-f703-4c5c-99eb-e3b3185d7eb3,"Don't like the Google changes to the sleep data, harder to read, less informative and it was a forced change. Not cool Goolge!!",,1,0,2024-04-20 19:23:30,,,,en,us
Google Play,69435152-67b5-4887-a97e-42399e80f2d2,Recent update has me thinking about going back to a Timex watch.,,1,0,2024-04-20 19:22:28,,,4.14.fitbit-mobile-110045073-617559692,en,us
Google Play,5db6e4b9-a824-4441-aef6-d465d4418cd2,"First it takes away the fun walking challenges like the virtual hikes which made me not want to use the fitbit anymore. Then the sleep graph got all sorts of confusing, hard to follow, and cluttered. It won't let me delete a sleep log now if I space out and it says I was asleep. So not the best accuracy and it's confusing. My husband and I have started shopping for other watch brands :D",,1,0,2024-04-20 19:12:24,"Hi, Merissa. We're sorry to hear about this. We'll make sure that our team is aware of your feedback. In the meantime, you can restart your Fitbit device to troubleshoot the sleep accuracy issue: https://goo.gle/restart

But if the issues persist, please don't hesitate to contact us on our help page here: https://goo.gle/contactfitbit",2024-04-20 19:17:41,4.14.fitbit-mobile-110045073-617559692,en,us
Google Play,ff1dfaca-069f-49c7-bcb4-e168a1d9d984,"Love the fact that EVERYONE is complaining about the latest update and the standard answer is ""contact us."" Right. Let's screw up everything that was good about this app and have EVERY SINGLE USER contact us individually to attempt to rectify the problem... And I'm paying for premium!! Time to start shopping for a different brand.",,1,0,2024-04-20 19:12:22,,,,en,us
Google Play,16daef08-453a-4594-9849-b60e804dbe9a,"App just went from good to horrible because of the new Sleep display. Previous display was perfect, I don't know why it needed to be changed, absolutely hate it.",,2,0,2024-04-20 19:09:08,,,4.14.fitbit-mobile-110045073-617559692,en,us
Google Play,f062b436-7525-4265-8979-da1a12025a70,I'm putting on my smart watch every day on the app.,,5,0,2024-04-20 19:04:07,,,4.14.fitbit-mobile-110045073-617559692,en,us
Google Play,db86fc0f-b628-4ce5-be0a-00c83606b9f8,"New sleep pages are difficult to read, too small and don't provide the info that I was used to seeing.",,1,1,2024-04-20 18:59:55,,,4.14.fitbit-mobile-110045073-617559692,en,us
Google Play,1fd3f5a1-c4c7-4314-bca4-85329af1471f,i hate the latest version. i can't access my sleep bed and wake times for the week in one view any more and good luck reading the sleep cycles.,,1,1,2024-04-20 18:57:32,,,4.14.fitbit-mobile-110045073-617559692,en,us
Google Play,e313bee3-b74a-4319-9b56-e1e9f86d9d21,"The new sleep graph is incredibly hard to read with the new color scheme and dotted lines, and removes functionality like being able to see what time you fell asleep in week or month view. I primarily use Fitbit for sleep tracking and theses changes are making me consider leaving the ecosystem altogether.",,1,0,2024-04-20 18:56:04,,,4.14.fitbit-mobile-110045073-617559692,en,us
Google Play,6ec89b68-a76d-40af-a7c4-0cd5c80b153d,Hate all the changes they made on the app.. the graphs are hard to read.. thinking about switching to something else,,1,1,2024-04-20 18:55:43,,,4.14.fitbit-mobile-110045073-617559692,en,us
Google Play,373653bf-5c59-45f1-b46e-c97ce8f48446,Exlent app,,4,0,2024-04-20 18:54:05,,,4.14.fitbit-mobile-110045073-617559692,en,us
Google Play,4f418d41-658e-42cb-9a7c-e4df9d0be348,"My Inspire 2 has always been great until a few days ago. Suddenly my sleep and exercise have stopped recording. Everything else (steps, active minutes etc) is still working. I have followed all advice given online and nothing has corrected the issue. I then saw I could contact fitbit support and they got back to me really quickly and easily sorted the problem. My fitbit watch had accidentally been switched from on wrist setting to on clip. Good support service.",,4,9,2024-04-20 18:53:48,,,4.13.fitbit-mobile-110041333-616222428,en,us
Google Play,de5edc7b-cb6a-4b5f-beab-0e773f033c99,I have been with Fitbit since the beginning. I had the very first one that came out and I'm now using the Sense 2. I used to love the Fitbit app and everything that features that it gave. I am now starting to shop for a new watches because I do not like the Google features and how it's linked to it. I have had more issues with trying to connect my data and getting my results for either sleep or workouts and then not coming up. I wish Fitbit never got purchased by Google.,,2,0,2024-04-20 18:43:59,"Hi Shannon - Sorry to hear that. All of our wrist-based devices automatically detect your sleep. Auto detection is based on your movement. To know more, see https://bit.ly/2JcLm5i. Need further help? Reach us at contact.fitbit.com so we can address your other concerns. ~Fitbit Support",2019-10-21 15:00:28,4.14.fitbit-mobile-110045073-617559692,en,us
Google Play,b48a6c70-5ee4-48b7-84aa-1164626a06d4,"I have always enjoyed using this app, but the most recent updates have been awful. First took away the mapping for walks and hikes. Now if I enter walking or hiking and how far or how much time MORE steps are added in making for an inflated and inaccurate count. The sleep updates make no sense at all. I'm not sure why these charges were made. The only reason I can think of is you want me to purchase the premium app and I am unable to do so. I'm going to start looking for something else to use.",,3,1,2024-04-20 18:26:18,,,4.14.fitbit-mobile-110045073-617559692,en,us
Google Play,33a68791-9871-4da4-aca4-9aac62647cad,"Integrates perfectly with my other wellness app, love it.",,5,0,2024-04-20 18:25:02,,,4.14.fitbit-mobile-110045073-617559692,en,us
Google Play,58d68063-ba7e-4bf8-88de-697316fcb790,I am not sure why but the sleep recording no longer logs properly since the last update. Kinda annoying. And yes I am wearing the fitbitnexaftly the same as always.,,2,0,2024-04-20 18:17:37,"Hi, Hans. We're sorry to hear this. We recommend checking these tips to track your sleep properly: https://support.google.com/fitbit/answer/14236407

For further help, reach out through phone, chat, social support, or through our community forums at: https://goo.gle/contactfitbit",2024-04-20 18:28:40,4.14.fitbit-mobile-110045073-617559692,en,us
Google Play,7f6594c7-c8bf-4919-9df6-2e73d574bfed,"The latest sleep update is horrible. Please change it back. At this point, I do not see a just reason to stay with my premium subscription. Mission accomplished Google.",,1,18,2024-04-20 18:03:41,,,4.14.fitbit-mobile-110045073-617559692,en,us
Google Play,68d543fe-c120-4176-912b-e180881bfcaf,"Each app update since the company switched ownership has been a down grade. Less and less data is available on the different screens. It's also annoying that the interface keeps changing, especially since it's not for the better. 👏🏽 Way to go for taking something that was functional and making it more useless.",,1,2,2024-04-20 17:59:02,,,4.14.fitbit-mobile-110045073-617559692,en,us
Google Play,0096ac9a-fca9-4edc-b04a-d94629aaac8f,"After the latest fiasco with the app update, I've ditched my fitbit and am researching other devices.",,1,2,2024-04-20 17:57:14,,,4.14.fitbit-mobile-110045073-617559692,en,us
Google Play,e7f82d4e-4df4-4868-ab60-a27096118062,"Had problems for the last 4 days, but this morning everything is back to normal. So changed back to a 5 star rating",,5,0,2024-04-20 17:49:16,,,4.15.fitbit-mobile-110048703-624243509,en,us
Google Play,c151ea1a-0fdd-41b2-9e99-0f219d933a85,Works great,,4,0,2024-04-20 17:41:05,,,4.14.fitbit-mobile-110045073-617559692,en,us
Google Play,0d812b95-287b-447e-8617-7a7cc71bef64,"Even though I thought I had cancelled my subscription. They took the money without prior warning. I emailed many, many times to to try request a refund and still nothing. I have not used the app for months. And have not used since the subscription renewal. They didn't even allow the 14 day cooking off period and recognise that the app had not been used. Super frustrating especially when its £79.99 and I have 3 young children. Exactly the reason I chose not to renew in the first place.",,1,1,2024-04-20 17:39:11,,,,en,us
Google Play,e1664c21-fb42-44ed-9793-760cc5ddbed0,"UPDATED: Why have my Sleep graphics changed? They are horrible! As someone in the Fitbit Community Forum said ""the sleep tracking features are now monochromatic, confusing, and difficult to read!"" ---After numerous attempts, I was finally able to restart my watch and reestablish the Bluetooth connection to my phone. I Am Grateful and Happy with my Fitbit again. ---My Samsung S21 plus updated last night, and my Versa 3 won't connect. My phone doesn't see it in Bluetooth Scan. Why?!",,1,3,2024-04-20 17:36:52,"Hi, Katie. We already identified the cause of the issue and users should now have a normal experience in the app again. But if you're still having trouble syncing or logging in, please don't hesitate to contact us on our help page here: https://goo.gle/contactfitbit",2023-10-15 18:20:16,4.14.fitbit-mobile-110045073-617559692,en,us
Google Play,18534c1c-5b34-43b0-9ba1-5d1fefc00969,the new sleep design is terrible hard to see. to much going on.,,2,3,2024-04-20 17:35:48,,,4.14.fitbit-mobile-110045073-617559692,en,us
Google Play,0f82596c-a5cd-4ad9-939a-304fdb8e6405,They changed the sleep tracking so that it provides next to no information. Will not be renewing my premium membership unless it's changed back,,1,3,2024-04-20 17:29:52,,,4.14.fitbit-mobile-110045073-617559692,en,us
Google Play,b2d2ea6a-71e9-4253-aa53-19aee763c073,"The update broke the Readiness Score. It keeps telling me my activity has been light for days despite a significant increase in my activity and the Fitbit app itself telling me in other metrics how much work I've put in. Additionally, the changes to the Sleep section are not better. I'm sure I can get used to it but the change was unnecessary and I hope this isn't the final result.",,2,0,2024-04-20 17:26:01,"Hi, Andrew. We're sorry to hear this. We're always looking for ways to improve and we appreciate your feedback. To know more about how Fitbit tracks your daily readiness score, please visit this: https://support.google.com/fitbit/answer/14236710

For further help, reach us at: https://goo.gle/contactfitbit",2024-04-20 17:39:11,4.14.fitbit-mobile-110045073-617559692,en,us
Google Play,15fd0b18-f293-4d27-93f3-78642a232449,The new update has the worst way of displaying sleep data,,1,2,2024-04-20 17:21:35,,,4.14.fitbit-mobile-110045073-617559692,en,us
Google Play,e8c9cfae-7c3e-4b8d-a2c9-77f909f38650,"With the newest update, the sleep log is confusing and not user friendly. Prefer the graphs and details from previous version.",,2,1,2024-04-20 17:19:59,,,4.14.fitbit-mobile-110045073-617559692,en,us
Google Play,027a5181-266f-4351-8ec7-f5afe46088c2,The new sleep tracking graphs are terrible!! Hard to read! No longer can evaluate sleep at a glance. Hate the change!!!,,1,1,2024-04-20 17:16:48,,,4.14.fitbit-mobile-110045073-617559692,en,us
Google Play,3de2b6c4-4d2b-40cb-8c41-d7d8415f8a37,Never reviewed my 2 year old fitbit app till now. This is just silly! What happened? The most recent update that changed the graph on your sleep is terrible. It's impossible to interpret or read. You can't rotate the graph anymore. You can't click on each section for a time frame. It's so hard to see on a white background. O2 stats are not even close to what they used to be and this was actually very important to me. Not a good update. Super disappointed FitBit.,,1,1,2024-04-20 17:16:19,,,4.14.fitbit-mobile-110045073-617559692,en,us
Google Play,add4a8ee-a6cf-47de-a416-6663e706dcdd,"This watch has done all that it said it could. It has monitored afib well, showing me when I had to go to the emergency room.",,5,0,2024-04-20 17:13:35,,,4.14.fitbit-mobile-110045073-617559692,en,us
Google Play,0873768b-4e8c-43c9-8027-b776adb2a05f,Would be better if the low battery alert would come to my regular email instead of just the Gmail account.,,3,0,2024-04-20 17:13:14,,,4.14.fitbit-mobile-110045073-617559692,en,us
Google Play,d2794106-e56b-4210-bf9a-323e91491227,Accurate and informative.,,5,0,2024-04-20 17:13:08,,,4.14.fitbit-mobile-110045073-617559692,en,us
Google Play,04e25faa-99bc-4b7f-ae00-3c920b01dae2,These people compulsively make their UI uglier and less useful with every update instead of fixing their longstanding bugs. Latest victim: sleep metrics.,,1,22,2024-04-20 17:11:58,,,4.14.fitbit-mobile-110045073-617559692,en,us
Google Play,b562fa5f-8725-41e1-a654-1ec4bc140157,"ETA: April 2024 update has completely ruined the sleep tracker. They merged the stage time with the graph so now both are absolutely unreadable. The new update is garbage. The UI is awful, the icons are childishly simplistic. I can't see the battery icon, and the sleep score won't update to the detail area. I want to revert back to yesterday's version, but I cannot. Am paying for premium but this isn't a premium design or functionality. I won't be paying for this any longer.",,1,7,2024-04-20 17:08:24,,,4.14.fitbit-mobile-110045073-617559692,en,us
Google Play,6523d3a3-bd55-4b16-83b0-ee9c45d1aa4c,I have paid for the premium subscription for years and I always enjoyed checking my sleep stats first thing every morning. The colors were nice and easy to read. Now... I absolutely HATE the new graphics. It's too bright and very hard to read and there are too many steps to find info that used to be laid out simply in one place. It's annoying enough that I will likely cancel my subscription and buy a different brand watch in the very near future. Dumb move fitbit!!!,,1,1,2024-04-20 17:08:16,,,4.14.fitbit-mobile-110045073-617559692,en,us
Google Play,648b4cb0-be6b-430a-8ab5-b69d7c8e2e76,"Apparently software updates are pushed out without thorough testing because there is often a second one close behind that fixes issues reported by users. And every darned time it does something stupid to my fitbit that makes me think it isn't working...wrong time, eating battery life for examples.",,3,0,2024-04-20 17:04:22,,,4.14.fitbit-mobile-110045073-617559692,en,us
Google Play,1a6d8b32-f8e2-4847-92cd-1a80c969b014,Stop changing the UI every time it updates it's worse,,1,0,2024-04-20 17:02:59,,,4.14.fitbit-mobile-110045073-617559692,en,us
Google Play,ba26f94b-9ec1-4f07-9429-fec7da32ee71,"I know that apps have updates all the time. I just don't like how fitbit just keeps changing how metrics are read/portrayed on the app. I get used to something, then they change it, and to me, not for the better.",,3,0,2024-04-20 16:56:53,,,4.14.fitbit-mobile-110045073-617559692,en,us
Google Play,c80ac503-1949-4c57-a60c-daad3ee3e69d,Fitbit is helping me forge my path back to wellness,,5,0,2024-04-20 16:49:57,,,4.14.fitbit-mobile-110045073-617559692,en,us
Google Play,a587437a-f3b0-4147-84c6-f40731575394,Google screwed it up,,1,0,2024-04-20 16:48:32,,,4.14.fitbit-mobile-110045073-617559692,en,us
Google Play,ac6c148e-22bb-402a-8d65-7737e19772a2,I don't like the new update but other then that the app is good,,4,0,2024-04-20 16:48:20,,,4.14.fitbit-mobile-110045073-617559692,en,us
Google Play,c5165401-10da-41be-9ab7-31c29b7fe073,"The updated app is awful. I can no longer easily navigate or interpret my data. The charts feel compressed, the colors are difficult to distinguish, and the organization of data was shuffled around to appear less-intuitively. If unable to allow us to revert to a previous app version or access an easier-to-read interface, I don't see myself purchasing another fitbit device when mine goes out.",,2,0,2024-04-20 16:46:18,,,4.14.fitbit-mobile-110045073-617559692,en,us
Google Play,0f7c22ac-0701-44f3-ab94-ac45d021a63c,"I'd like to give this zero stars. This new update ruined the sleep log. I thought it had a glitch and was broken until I checked out all the latest reviews. Add this to the previous ""new"" glitch this winter(2024). When I try to open an irregular heartbeat report/notification I get a blank page that won't respond to my efforts to navigate out of it. I have reinstalled the app and there is no change. I've restarted my phone and not fixed. Fitbit is no longer useful to me.",,1,12,2024-04-20 16:34:34,"Hi, Ann. We're sorry to hear this. Thanks for trying to fix it. Please make sure that your Fitbit app is updated: https://goo.gle/AppQs. To learn more about Fitbit Irregular Rhythm Notifications, see: https://help.fitbit.com/articles/en_US/Help_article/2467.htm. If you need more help, reach out to our support team at https://goo.gle/contactfitbit",2024-01-10 22:04:11,4.15.fitbit-mobile-110048703-624243509,en,us
Google Play,ea7240da-bb30-4a24-b5d5-48fc56216a98,The new visual of the sleep duration is not user friendly and for elder people is even a worst impact. Also can no longer see the specific awake/asleep times and others features. Considering ditching fitbit completely.,,2,2,2024-04-20 16:26:14,,,4.15.fitbit-mobile-110048703-624243509,en,us
Google Play,ba804666-69d3-473b-9574-d5517022965c,"Not sure if there was an update or what happened to the app but it is not good, use to be able to click on your sleep and get a nice very readable graph and now it's just a horrible mess that you can't read. Hope it gets fixed.",,2,0,2024-04-20 16:18:38,,,4.14.fitbit-mobile-110045073-617559692,en,us
Google Play,ec4a23bb-d624-4e63-b6b8-b31bf3642d7f,"Update has made app nearly useless. Sleep graph very ""graphic design is my passion"" and illegible.",,1,0,2024-04-20 16:18:18,,,4.14.fitbit-mobile-110045073-617559692,en,us
Google Play,9f9a8778-a791-4adf-ace7-da70e6f1b652,"I honestly don't know why they would change the sleep portion of the app, as now it is absolutely trash. Time to start looking for a different brand, fitbit has been getting worse and worse. Obviously they want their customers leave fitbit for a different provider, as I read the other reviews it seems to look that way for sure. Not surprised google would screw it up. I had a pixel 6 for a year, worst phone I ever owned, I had to get rid of it. Google stands for garbage.",,1,6,2024-04-20 16:17:27,,,4.14.fitbit-mobile-110045073-617559692,en,us
Google Play,5048f7cd-524c-45bb-be6c-0f055340ed84,"I am on my 3rd Fitbit and use the data regularly. I used to love it until the latest update. Fitbit, you have ruined the app. The new sleep metrics are very hard to read, unfriendly. One reason I have continued to use Fitbit is due to the apps dashboard but this new layout design is horrible!!! Please fix!",,2,0,2024-04-20 16:12:11,,,4.14.fitbit-mobile-110045073-617559692,en,us
Google Play,b28b872a-af3e-4ca4-acba-9d586ca96efb,This app provides a great baseline for activities and goals. I do agree with many of the other comments about the sleep portion of the app.,,5,0,2024-04-20 16:07:03,,,4.14.fitbit-mobile-110045073-617559692,en,us
Google Play,d485d22e-f777-486b-8dbb-156d21e49812,"I cannot believe that Google Wallet support has still not been fixed. Even though my bank shows up in the supported list I still get a ""Something went wrong error"".",,2,0,2024-04-20 16:06:54,"Hi, Alan. We're sorry to hear this. For tips about contactless payment, see: https://support.google.com/fitbit/answer/14236521

For further assistance, please contact our support team at: https://goo.gle/ContactFitbit",2024-04-20 16:16:49,4.15.fitbit-mobile-110048703-624243509,en,us
Google Play,d0c5457c-e4b8-4aaa-9555-e204eb6412cf,Keeps me motivated ✨️,,5,0,2024-04-20 16:01:22,,,4.14.fitbit-mobile-110045073-617559692,en,us
Google Play,d6bb3d37-b442-48df-8b1c-904d6bb779ce,UPDATE: sucks. Sleep scale doesn't give details on sleep just the scale. Everything is still brighter than bright white. Kinda glad my watch is dying after 2 yrs.. I getta shop around. ✌️ (read others posts.. GLAD I'm not the only one),,1,2,2024-04-20 16:01:03,,,4.14.fitbit-mobile-110045073-617559692,en,us
Google Play,cd51be9f-859d-4dc6-80d4-0e3dd182b1b2,This recent update is disappointing. The sleep data has gone from helpful to useless. I've used my Fitbit for three years now and enjoyed tracking the data but now it's just a very overpriced pedometer. I have been thinking of upgrading my device recently and know that I'll now be looking for a different brand all together.,,2,1,2024-04-20 16:00:54,,,4.14.fitbit-mobile-110045073-617559692,en,us
Google Play,cf36cdc6-f19b-42e0-9de0-327b7a82e688,"The latest update to the sleep score is NOT an improvement. It's more convoluted, harder to get the info you want, and it's not showing all the sure data each day. As an example, some days I get the heart rate data, others I don't. In the old app, of always get everything each day. It's there a way to go back? I'm in IT and used to change, but this one is not worth it.",,1,3,2024-04-20 15:57:51,,,4.14.fitbit-mobile-110045073-617559692,en,us
Google Play,9e7703bb-6d5c-4158-88e9-eda55c39c38a,"The new update makes this app total garbage, just read all the comments.",,1,5,2024-04-20 15:57:32,,,4.14.fitbit-mobile-110045073-617559692,en,us
Google Play,e9267e7f-07b2-4583-b38e-a4749dc011f5,Its awesome!,,1,0,2024-04-20 15:48:28,,,4.14.fitbit-mobile-110045073-617559692,en,us
Google Play,26500534-f2f1-4657-8131-e4fdcc6674e6,"The recent update on the sleep score display is TERIBLE!!! the new look is awful 😖. Please bring back the previous version. With this new version, you can't pinpoint certain parts of the sleep stages (ie see specific times you were awake).",,2,281,2024-04-20 15:47:48,,,4.14.fitbit-mobile-110045073-617559692,en,us
Google Play,46a54347-bfb1-441b-9b3a-d8b188b9f0d1,"Update 4/20/24. Google ""updated"" the app, and a lot of formerly included features are now behind a paywall. In order to get back functionality that was included with a purchase of a fitbit, you now have to pay a monthly fee. Google- Just Be Evil. Update 9/18/2020 We need to reboot the phone several times each day because of ""tracker not found"" errors. Looking at Houly Steps caused app to crash. My wife has lost entire days steps. Each update seems to make this app less reliable.",,1,6,2024-04-20 15:45:53,,,4.14.fitbit-mobile-110045073-617559692,en,us
Google Play,69a251ca-c515-4c28-9ecd-0ab9b076f22d,"Currently my dashboard is just black. I see from the Community that others are experiencing the same problem. I , like many others would like to see the return of the previous format of the sleep graph. The new one is a shocker.",,1,0,2024-04-20 15:40:08,,,4.14.fitbit-mobile-110045073-617559692,en,us
Google Play,ff5d6b6c-a40f-4c3c-b724-2ae55fc5a736,The design team should be immediately fired,,1,2,2024-04-20 15:38:06,,,4.14.fitbit-mobile-110045073-617559692,en,us
Google Play,e5a4321c-35d3-4560-a261-f70384773257,"Fitbit did absolutely nothing to fix my issue over the 3+ months that I have been contacting them about my issue. They randomly would close my ticket without communication and kept telling me to just wait until the next update. They never fixed my issue, I was never contacted by an actual person. They stole my subscription money without providing the services I paid for. I am canceling my subscription, throwing away my fitbit, and going with a different service. No one should get a fitbit ever.",,1,2,2024-04-20 15:33:16,,,4.15.fitbit-mobile-110048703-624243509,en,us
Google Play,1558f2b9-6465-426c-baa3-eacd4b61d2ed,Afraid to do update. My husband did and it stinks. Go back to old ways.,,1,0,2024-04-20 15:31:19,,,4.13.fitbit-mobile-110041333-616222428,en,us
Google Play,e2b7b8fa-5480-4550-9793-0099ec0a3ad2,"I love this app! My only wish is that when you're logging food, you can check mark each item you ate so you can log them all at once.",,5,0,2024-04-20 15:29:41,,,4.14.fitbit-mobile-110045073-617559692,en,us
Google Play,f79b2a4c-4f0d-41ff-9011-1e0c0170e60a,I hate the new sleep results display. I'm thinking about trying a different device.,,1,1,2024-04-20 15:26:49,,,4.14.fitbit-mobile-110045073-617559692,en,us
