source,review_id,review_description,review_title,rating,thumbs_up,review_date,developer_response,developer_response_date,appVersion,laguage_code,country_code
Google Play,cd708396-3f60-4b04-9325-9321811e4821,Really good app although I must say it could be alittle more disabled friendly for example disabled friendly exercises achievements eg badges trophys am speaking for myself being disabled I understand its a 'fitness app' but disabled people need certain exercises to help them as well if this makes any kind of sense x,,4,0,2024-04-21 02:33:01,"Hi, Becca. Get the attention of our Product Teams by sharing your ideas on our Suggestions Board: https://community.fitbit.com/t5/Feature-Suggestions/idb-p/features

We'll see you there.",2024-04-21 02:37:03,4.14.fitbit-mobile-110045073-617559692,en,us
Google Play,b495d545-4d57-486f-9717-9f094fa3e709,"Update makes it not sync properly, relies too much on wifi to work all the time. Now I can't even recover my password. They probably want you to have to buy a new one lol.",,4,0,2024-04-21 02:16:51,"Hi, there. We have troubleshooting steps that can help your Fitbit device to sync again: https://goo.gle/syncing

But if the issue persists, please contact us so we can help you in finding a better resolution. You can reach our help page here: https://goo.gle/contactfitbit",2024-04-21 00:17:59,4.14.fitbit-mobile-110045073-617559692,en,us
Google Play,0e8c22ff-4d02-43cb-885b-b6885d5580fd,Great app. Enjoying the information it provides.,,5,0,2024-04-21 02:10:40,,,4.14.fitbit-mobile-110045073-617559692,en,us
Google Play,b22204f5-a9e9-4c1e-9af9-6955d4944f2a,"The UI has drastically changed, specifically the sleep section of the app. It used to be so clear to read and access sleep history, including detailed information about a sleep, but now it's really difficult to read and access things. I previously had thoroughly enjoyed the app but now it's very difficult to use and read reports on here.",,1,2,2024-04-21 01:57:40,,,4.14.fitbit-mobile-110045073-617559692,en,us
Google Play,e90ce301-a14e-4115-974e-ba8b5a3598f2,"As a fan of Google, I kind of expected more after the change over. I don't understand why it takes so long to sync my fitbit with the app or why it takes so long for the app to reflect calories and exercise to show up across all tabs. I don't get why sometimes I can't track food because there are zero results as if no one has ever eaten an egg before *rolling eyes* of course I'm going to just live and hope it gets fixed but I'm looking at other options. Never used to be like this before Google",,2,1,2024-04-21 01:34:18,"Hi, John. We're sorry to hear about this. The first thing we have to do to resolve these issues is to get your device to sync constantly. Please try our syncing tips here: https://goo.gle/syncing

But if the issues persist, please don't hesitate to contact us on our help page so we can take a closer look: https://goo.gle/contactfitbit",2024-04-21 01:43:31,4.14.fitbit-mobile-110045073-617559692,en,us
Google Play,5e176d57-d0ca-4239-a5c0-3b95ef4d3cf1,I am happy with the performance of this device,,4,0,2024-04-21 01:22:38,,,4.14.fitbit-mobile-110045073-617559692,en,us
Google Play,d58d3733-c75c-43d4-b1d3-5ba59f3f8564,I really like that it rates my movement and my sleep. It is definitely more than a pedometer!,,5,0,2024-04-21 01:09:09,,,4.14.fitbit-mobile-110045073-617559692,en,us
Google Play,c14e6b09-0665-4c8a-9649-f697cacb5748,"Used to be ok but doesn't work since the update. Logs out constantly, sleep not being recorded, sleep details changed to something you can't understand as well as chart used before etc etc... Gutted as only just upgraded to sense 2 but app is a real let down. Sleep tracker is high priority and it's not working.",,2,1,2024-04-21 00:54:49,"Hi, Lauren. We're sorry to hear about these. We'll make sure that our team is aware of your feedback about the sleep info in the Fitbit app. But for the other issues, please contact us on our help page so you can share with us more details. You can reach our help page here: https://goo.gle/contactfitbit",2024-04-21 01:28:55,4.15.fitbit-mobile-110048703-624243509,en,us
Google Play,36bdd1b6-3725-404b-a2b6-f3dc5cb8094f,"Terrible. Why would you downgrade everyone to this new ""update""? Awful, awful, awful. Edit: my last review was 09/23. With this new update 04/24 the sleep tracking is now unusable. Sadly this is my last Fitbit and I'll be moving on.",,1,1,2024-04-21 00:52:18,,,4.14.fitbit-mobile-110045073-617559692,en,us
Google Play,06d857cd-147d-463b-9097-1f2020d651f9,I am pleased with the device.,,4,0,2024-04-21 00:46:48,,,4.14.fitbit-mobile-110045073-617559692,en,us
Google Play,d12b76de-2a92-40f7-b8af-bc82c8f15306,"I used to have a good experience with this app until the latest two updates. The most recent one is just downright awful. The sleep graphics are not at all user friendly, the color scheme is bad and the whole design is just plain terrible. It's like they want to make people pissed off by choosing the most bland and unfriendly graphics. It makes me think of choosing another brand because I don't even feel like checking my stats if they keep this terrible design. Bring back colors!",,1,2,2024-04-21 00:37:57,,,4.15.fitbit-mobile-110048703-624243509,en,us
Google Play,907216b5-6aa2-42a0-b91d-85da92515d2a,Was brilliant but since Google took over I keep loosing connection with my phone and it takes ages to get it back. The phone is a Samsung s22 ultra and updated as and when necessary. I am now thinking of just going back to an ordinary watch!! Update 20/04/2024 If I could give no stars I would. Since Google took over the app has been changed and not for the better! The sleep record is all over the place. It is now more difficult to make sense of and is no longer accurate despite Updates 😕,,1,1,2024-04-21 00:34:53,,,4.15.fitbit-mobile-110048703-624243509,en,us
Google Play,a861b991-b669-4bc9-830a-3e08dddeea41,I've used fitbit for 10 years and the latest update is dreadful! Can't delete a sleep that didn't happen and the sleep pattern is not easy to see or understand anymore. It's terrible! Please fix it,,1,1,2024-04-21 00:33:43,,,4.14.fitbit-mobile-110045073-617559692,en,us
Google Play,df396752-b4df-4a5d-b7a1-a32ada3e2209,It keeps dropping out,,1,0,2024-04-21 00:32:37,"Hi, Deborah. If you're having trouble syncing your device, you can try the tips here: https://goo.gle/syncing

But if the issue persists, please contact us on our help page so you can share with us more details of the issue. You can reach our help page here: https://goo.gle/contactfitbit",2024-04-21 00:50:16,4.14.fitbit-mobile-110045073-617559692,en,us
Google Play,fe26d217-6885-4094-8b54-f2c97428a003,Hate needing to connect to the internet to check my stats app is slow and I feel like it steals my information and the Eula was way too long,,1,0,2024-04-21 00:19:16,,,4.15.fitbit-mobile-110048703-624243509,en,us
Google Play,853a0c27-83e3-492f-97b4-abe48a43e00d,Not a fan of the new sleep stages it's giving me a headache just looking at it.,,3,5,2024-04-21 00:05:45,,,4.14.fitbit-mobile-110045073-617559692,en,us
Google Play,a0484351-6778-4ec5-a209-ddf6b7c9ebf3,"Still miss being able to compete with my friends in the UK. Was a great way to stay in touch with them, having moved to New Zealand. Would love it if it came back. 🙃 Otherwise love my fitbit Sense. Would also like to record my blood sugars with food to see when I am on the right track at reversing pre diabetes.",,4,2,2024-04-21 00:02:43,,,4.14.fitbit-mobile-110045073-617559692,en,us
Google Play,7b8a2d73-4bd0-4fae-a59b-5ec9e9d9517f,Unfortunately it will not give me an option to sync with health connect app. I use a two separate fitness app to track workouts and nutrition; I had hoped to sync data but it will not link. The workout and nutrition tracking in Fitbit are okay but not what I am needing.,,1,0,2024-04-20 23:41:37,"Hi, Alejandro. Just to cover all bases, you can review our steps on how to set up Health Connect in the Fitbit app: https://support.google.com/fitbit/answer/14506680

But if you need further help, please don't hesitate to contact us on our help page here: https://goo.gle/contactfitbit",2024-04-20 23:53:06,4.14.fitbit-mobile-110045073-617559692,en,us
Google Play,b5489a41-9ddc-4522-9e17-920c52332476,Loved the info it gave me before the update. Still trying to work a few things out .okay for now,,5,0,2024-04-20 23:27:38,,,4.14.fitbit-mobile-110045073-617559692,en,us
Google Play,102d1488-cb63-4cae-beae-44d49195d764,"This app is great to visualize data collected by your Fitbit/Google Pixel Watch. The app has felt dated for a while but they've taken steps to update the visuals so they look more beautiful while still being functional and useful. I love the new home screen and sleep page redesigns, I can't wait to see the whole app adopt the new design over time!",,5,0,2024-04-20 23:26:19,,,4.14.fitbit-mobile-110045073-617559692,en,us
Google Play,56a48f6e-f026-4655-b4ac-b74a55b6d742,No more challenges is LAME,,2,0,2024-04-20 23:22:01,,,4.14.fitbit-mobile-110045073-617559692,en,us
Google Play,36475b8d-d8fc-4cf2-b9b5-cb2adef7a2a8,"there's a bug, it sometimes syncs, other times it get 🤏 then stays there, and won't update anything correctly e.g calorie intake etc has a mind of its own. Frustrating when you want to continue using it for weight loss/calorie tracking!!! (Which has been working but this is throwing me out🙄) Don't suggest troubleshooting, I've already done the lot, still the same.. pls fix it, pls EDIT: no, fix your app, it's your end, not mine. Also can't access HR tile, just loading Pinwheel.. (just noticed)",,1,6,2024-04-20 23:21:50,"Hi, Katie. This is definitely not an experience we want you to have. We appreciate your effort for troubleshooting. Please contact us so we can help you in finding a better resolution. You can reach our help page here: https://goo.gle/contactfitbit",2024-04-20 23:14:17,4.14.fitbit-mobile-110045073-617559692,en,us
Google Play,e81c867e-1342-4a0b-852e-faedf20ae2d8,I have to agree with the many reviews complaining about the changes to the sleep data. Huge step backwards!,,1,4,2024-04-20 23:21:00,,,4.15.fitbit-mobile-110048703-624243509,en,us
Google Play,77bf35f6-7f61-4719-8daf-2558ab88fb8e,Dreadful update - the latest update has ruined the one part of the app I use everyday. The sleep detail is now useless it is impossible to tell at a glance how you slept. Please fix it give it some definition it's just blobs on a white background.,,1,1,2024-04-20 23:12:07,,,4.14.fitbit-mobile-110045073-617559692,en,us
Google Play,b917ce59-8e8d-4ff5-8de1-3c3554c5a672,Love it.It monitors my heart rate.How many steps I do my work out at the gym?It's great,,5,0,2024-04-20 22:54:23,,,4.14.fitbit-mobile-110045073-617559692,en,us
Google Play,7d6b4db9-ab05-4fe6-867a-a8e14a630df7,"Can't sync, won't connect to Bluetooth. I tried all the troubleshooting steps, restart to reinstall app. STILL NOT sync and my Fitbit sense 2 didnt show real time track of my steps.....so frustrated. Update: I restarted my phone and both my Fitbit watch and App have been working properly for the last 24 hrs . Hope it stays that way.",,3,1,2024-04-20 22:46:38,"Hi, Mai. We're sorry to hear this. This isn't the experience we want for our customers. Thanks for trying to fix it. If you haven't done so already, we suggest checking these syncing tips: https://goo.gle/syncing

If you need more help, please reach out to our customer support team at https://goo.gle/contactfitbit",2024-04-19 17:35:04,4.14.fitbit-mobile-110045073-617559692,en,us
Google Play,5fdaf200-584b-4b5c-a6ba-ebca1e970b6a,Misjudged just needed a factory reset,,4,0,2024-04-20 22:39:34,"Hi, there. This is definitely not an experience we want you to have. We have syncing tips that can help: https://goo.gle/syncing

But if the issue persists, please contact us on our help page so you can share with us more details of the issue. You can reach our help page here: https://goo.gle/contactfitbit",2024-04-20 20:05:39,4.14.fitbit-mobile-110045073-617559692,en,us
Google Play,d85c8044-da31-4658-acfc-90903ca680e9,Recent update stupidified the interface and removed the battery charge indication so you can no longer keep track of when the watch needs charging until it dies. They updated again and despite all odds they actually made the interface worse. It is extremely ugly and hard to read stats now. Stars keep going down.,,2,1,2024-04-20 22:34:31,,,4.14.fitbit-mobile-110045073-617559692,en,us
Google Play,e662f67b-6a47-4355-be52-0d38f1fbed83,"I have loved Fitbit and used it for the better part of the last 10 years. I have paid to have a premium subscription for the last 4 or 5. Today I was forced to move everything over to Google. This meant deleting my kid's fitbit data. Devastated them. Over a year's worth of progress down the drain. After over 3 hours of chat with customer service our devices are still useless. This is the most unreal experience I have ever had in my life. When my Fitbit dies, I'm going to look elsewhere.",,1,0,2024-04-20 22:29:54,,,4.14.fitbit-mobile-110045073-617559692,en,us
Google Play,1fd89928-ee35-4298-8ad1-d212891c6528,The app looks broken now... whoever approved this change should be fired or reprimanded and sent through an educational process in order to keep their job.... and not ever do somethimg like this again,,1,1,2024-04-20 22:25:52,,,,en,us
Google Play,fa2490d1-85c4-497b-b8b6-af7073c6011e,Accurate and reliable measurements of jogging parameters and distances which I use it for.,,5,0,2024-04-20 22:20:53,,,4.15.fitbit-mobile-110048703-624243509,en,us
Google Play,fd352c52-c8e3-45bb-afb0-933c0d0254b4,"The new sleep data analysis is very irritating, please give us back the user friendly version",,3,2,2024-04-20 22:12:52,,,4.15.fitbit-mobile-110048703-624243509,en,us
Google Play,b297ccf8-8e7c-4e51-bf3b-c4ba76fda58e,"Don't like latest update to daily sleep profile. I no longer have the ability to delete a period of time that my Fitbit ""thinks"" I'm sleeping, when I'm actually just being quite still for a long time because I'm doing something such as watching a movie. I'm no longer going to get an accurate picture of my stats! I would appreciate switching it back!",,2,1,2024-04-20 21:58:19,"Hi, Susan. We're sorry to hear about this. When your body is completely at rest and you haven’t moved for about an hour, it's expected behavior for your device to record that you’re asleep. You can find more info here: https://support.google.com/fitbit/answer/14236407

You can also contact us on our help page: https://goo.gle/contactfitbit",2024-04-20 22:40:18,4.14.fitbit-mobile-110045073-617559692,en,us
Google Play,88c5f6f5-5504-4c7d-8eb3-2bcbba3046cf,"(UPDATE) Recently they've made the logs, which were INCREDIBLY helpful for me inaccessible, the UI/charts are harder to read, unpleasant and the most you can access are averages for things like sleep, which for one, were already accessible before, and two, doesn't help me much. (Old review) I deal with POTS and some minor heart issues as a result of EDS and this helps me monitor my condition and know when I need to rest far more easily than trying to keep a finger oximeter on me at all times.",,1,0,2024-04-20 21:55:29,,,4.14.fitbit-mobile-110045073-617559692,en,us
Google Play,55beb299-42e8-4dc9-925f-f648babaaf64,"I hate the layout in the newest update, change it back.",,4,0,2024-04-20 21:44:48,,,4.14.fitbit-mobile-110045073-617559692,en,us
Google Play,7f3545d7-bbc3-42ea-8578-9bcd3c12c44f,I love the app!!!,,5,0,2024-04-20 21:40:25,,,4.14.fitbit-mobile-110045073-617559692,en,us
Google Play,d517497d-49e4-4c14-8990-f6000b587520,"It allows me to take my medical readings for the different conditions that I'm dealing with medically with my heart, blood sugar, cholesterol and various other ailments.",,5,0,2024-04-20 21:39:00,,,4.14.fitbit-mobile-110045073-617559692,en,us
Google Play,8136aa42-3629-4031-9624-adc8ed3102ad,I have been a Fitbit user for many years for the sleep monitoring. The recent app update on the sleep is absolutely terrible. I agree with the other users comments about the change of the bar graph on the sleep is useless nor user-friendly. Before it was simple and able to see what time of the night you were in various sleep stages. Now you don't know what times you are in various stages. This was the main reason why I got Fitbit in the first place. Bring back the original graph. Horrible,,1,1,2024-04-20 21:25:05,,,4.14.fitbit-mobile-110045073-617559692,en,us
Google Play,9a83473a-9c99-4d2d-a4db-8a5e3e223291,"Ah, it used to be better before Google bought the company and stared making changes to the appearance & how data was organized. Especially the ""sleep"" part, it used to be color coded. Now I find I can't just glance at it to know what's going on. That's the most striking example, but there are others. Everything seems whitewashed now and it's less easy. Not a fan, wish I had an option to switch between styles.",,3,0,2024-04-20 21:20:39,,,4.14.fitbit-mobile-110045073-617559692,en,us
Google Play,9a413c13-c1ee-4342-a470-bceb920ea32e,"I hate to write this review because I love the Fitbit app, I pay for the subscription, but the new look, especially the new look of the Sleep tracking section is so ugly and unnecessarily confusing. Please just give us the old look back or make it an option. The sleep tracker is why I give you my money in the first place.",,5,3,2024-04-20 21:08:44,,,4.14.fitbit-mobile-110045073-617559692,en,us
Google Play,4ab23cea-9e15-4245-853f-04f6a5fea173,"The last update took it to 2 stars from 5. I was really liking the set up, but now it's all so different, I don't know what everything is and the measurements are VERY visually different.",,2,0,2024-04-20 21:00:06,,,,en,us
Google Play,8b629b61-3dfe-46d4-8e6e-2a07df6cf6e1,"I enjoy the sleek design of my Inspire 2...and, of course, keeping track of my daily activities 😀 Soon need to upgrade, but quite content with the Fitbit I currently have",,5,0,2024-04-20 20:58:13,,,4.14.fitbit-mobile-110045073-617559692,en,us
Google Play,29a5d263-7084-43e7-897f-794bd24c2d61,The 1st version was simpler and better. Yep 1st version still better.,,3,0,2024-04-20 20:52:34,,,4.14.fitbit-mobile-110045073-617559692,en,us
Google Play,2f5470d7-ddb4-4b2c-93fd-63a5a7987a4b,Very good 👍,,5,0,2024-04-20 20:40:06,,,4.15.fitbit-mobile-110048703-624243509,en,us
Google Play,d7d8bd85-86a1-439f-8b4e-deb6d1a7fae6,"The new sleep chart is absolute rubbish. It was great before the latest update. I know that I'm not a fan of change in general, so I gave it a few days before commenting. I thought I might just get used to it. NOPE! I hate it more every day. Since sleep tracking is my primary use for Fitbit, I am very, very disappointed.",,1,2,2024-04-20 20:37:52,,,4.14.fitbit-mobile-110045073-617559692,en,us
Google Play,7f2cb62a-018f-458d-a2bc-8248a1d76c3f,Great way to track sleep and how ready your body is for exercise. Also a good way to track exercise.,,4,0,2024-04-20 20:37:38,,,4.14.fitbit-mobile-110045073-617559692,en,us
Google Play,02ed001e-0901-42b1-9154-cf01480ffb78,Great motivational tool,,5,0,2024-04-20 20:37:25,,,3.4.1,en,us
Google Play,d6441bd6-bbab-4614-837f-7d626cc2231e,"The app was great til the update. The one problem I've got is that the sleep function has changed now I can't even click on it when I go to bed and why have you removed the sleep analysis graphs that show the different phases of sleep (REM, Deep, Light and Awake) it was easy to understand at a glance instead of these pecked lines. Why changed something that worked perfectly fine to something that is hard to follow.",,3,1,2024-04-20 20:32:44,,,4.14.fitbit-mobile-110045073-617559692,en,us
Google Play,807d3995-4a16-4ceb-b969-ba9d534ee8ed,thank you for bringing the battery percentage level back... now fitbit messed up the app with the sleep tracking function being a disaster now. can't read it. I don't see where can delete some of the tracking where it shows you sleeping for an hr or so when you were awake. This was a terrible mistake for fitbit,,1,3,2024-04-20 20:19:02,"Thank you for taking time to share your feedback here with us, Gary.",2023-12-13 01:02:15,4.15.fitbit-mobile-110048703-624243509,en,us
Google Play,5a01e209-fe24-410c-900c-e9938ed578c4,slow to update. not super accurate with activities or sleep tracking. does not automatically sync,,3,0,2024-04-20 20:17:00,"Hi, Elad. The first thing to do is to make sure that your device is constantly syncing. You can follow our syncing tips here: https://goo.gle/syncing

But if the issues persist, please contact us on our help page so we can investigate. You can reach our help page here: https://goo.gle/contactfitbit",2024-04-20 20:30:23,4.14.fitbit-mobile-110045073-617559692,en,us
Google Play,8fc1e465-0899-4ddd-8fa2-bc3953c7e688,I have had fitbit for years but l feel like it's time to look elsewhere.The device never gives the correct steps and time when doing GPS.,,1,0,2024-04-20 20:14:22,"Hi, Denise. We have tips that can help improve the accuracy of your Fitbit device: https://support.google.com/fitbit/answer/14236920

But if the issue persists, please contact us so we can help you in finding a better resolution. You can reach our help page here: https://goo.gle/contactfitbit",2024-04-20 20:31:15,4.14.fitbit-mobile-110045073-617559692,en,us
Google Play,acffa59f-3ca2-46b2-ab65-56726089b690,This app is more about tracking us as consumers and less about providing us a service. Too complicated to view items on the computer.,,2,1,2024-04-20 20:13:04,,,4.14.fitbit-mobile-110045073-617559692,en,us
Google Play,d4713b6d-1f10-49eb-b052-8c88675959c0,So white it hurts my eyes to look at it. Everything is washed out looking. The new sleep details are hard to read. Please enable a dark mode. There's no easy way to coordinate data with Google Fit even though they are both Google products.,,2,0,2024-04-20 20:11:57,,,4.14.fitbit-mobile-110045073-617559692,en,us
Google Play,22df4c90-73ca-46d4-8768-ad216b74c4c0,I agree with everyone else on the bad changes to the UI; especially the Sleep forms. Please roll the UI changes back! Question: Is it possible to select a previous version for installation?,,2,0,2024-04-20 20:07:11,,,4.14.fitbit-mobile-110045073-617559692,en,us
Google Play,427344d5-f563-4888-84ed-bf8151241149,This recent update sucks. I can no longer look at specific sleep times with the new sleep graph. I like being able to tap on certain sleep phases and see how long the phase was. Please put it back the way it was for years. Very unhappy with this now.,,3,0,2024-04-20 20:04:55,,,4.14.fitbit-mobile-110045073-617559692,en,us
Google Play,38b4390f-072a-40dc-925c-d9b502bdb4ed,New design of app is terrible. I want to see a scrollable list of days with my step and sleep logs. App developers focused on design over function. Visual update was unnecessary.,,1,2,2024-04-20 20:04:45,,,4.14.fitbit-mobile-110045073-617559692,en,us
Google Play,371d9b90-e4ec-4946-84dc-1f735f3e0966,"Like it, but could be better",,4,0,2024-04-20 19:55:02,,,4.15.fitbit-mobile-110048703-624243509,en,us
Google Play,2e085721-8f6d-412c-82f7-565ea7eaf272,Change the sleep charts back! Now it's harder to read and see the data. Stop ruining this app! This app was better before Google ruined it!,,1,1,2024-04-20 19:52:45,,,4.14.fitbit-mobile-110045073-617559692,en,us
Google Play,53034028-07b1-4f53-a783-5273cbe3b260,"Why are you constantly changing this app??? Fix the SLEEP BREAKDOWN PLEASE.. I'm paying monthly for you to mess it up. Fix the RECIPES. Worthless without ingredient amounts with instructions. Vidios are cute but USELESS.🥵 - 1☆""HATE"" new app look. It's clutter, childish, ugly. I used Alta HR for years but bought 2 Charge 5's, one for me & one for friends' Birthday. We love them.",,1,2,2024-04-20 19:49:24,,,4.14.fitbit-mobile-110045073-617559692,en,us
Google Play,fa412298-c563-43d8-84a5-2084e951e371,"The new design will only work for me if I am using Google Chrome. It will not work on windows 11. I totally agree with others that the new sleep design is just plain horriblle. How do I get fitbit app to work on Windows 11, anyone have a clue?",,2,0,2024-04-20 19:44:48,"Hi, Bob. We'll make sure that our team receives your feedback about the sleep tile. In the meantime, we stopped supporting syncing with Windows phones or computers in 2022. To sync your Fitbit device, download and use the Fitbit app for phones. For info about supported devices, see: https://www.fitbit.com/global/us/technology/compatible-devices",2024-04-20 20:08:47,4.14.fitbit-mobile-110045073-617559692,en,us
Google Play,402cb25a-1d67-4f35-a416-36ede81e1a4b,"Was good, the latest interface on the app, rendered it useless. It really doesn't show you anything usefull, or to impossible to understand",,2,0,2024-04-20 19:44:36,,,4.14.fitbit-mobile-110045073-617559692,en,us
Google Play,abcec2d2-caeb-481e-9ddc-a1a765158f5e,"Update* Again Fitbit keeps changing the app and it's not for the better. I'm on my 6th Flex 2 and been with Fitbit since 2017. All the good features -group challenges, sleeping, old way to view everyday steps, it all sucks now, or doesn't exist. No longer loyal to Fitbit. Just ordered a different tracker. Fitbit seems like the thing of the past now. 2023:This new update sucks and I do not like it. Why would you change what is working. You need to fire whoever decided to switch all this around.",,1,5,2024-04-20 19:41:15,,,4.14.fitbit-mobile-110045073-617559692,en,us
